author,subreddit,created_utc,body
sir_sri,explainlikeimfive,1388547353.0,"&gt;Intel and AMD processors have different ISAs or Instruction Set Architectures.

You're thinking Intel and ARM.

AMD is the sole  licensee of the x86 ISA (at least that anyone has heard of, via and transmeta have also made X86 cpu's but they're very very limited markets), and the AMD64/IA64 instructions were added by AMD (and then adopted by intel).

That's why Intel and AMD CPU's are compatible without  a recompilation or interpreter, they have the same ISA, although there's a constant battle to add the odd new thing in that the other guy doesn't have. 


&gt; Intel ISAs preforming a task approximately 20% faster as Intel's cores can handle instructions better. 

While that's not the iSA persay, that's the gist of it.  Intel cpu's clock for clock are much more efficient - this is called the microarchitecture, and it's the implementation of the ISA.  A few years ago AMD briefly almost caught up to Intel, but Intel  has much better fabrication processes than anyone else in the business, so even running identical microarchitectures Intel can use less power for the same thing. 


&gt;they are more efficient

efficient is an odd metric.  Definitely intel processors are more efficient in terms  of performance per watt for synthetic loads.  But in terms of performance per dollar AMD processors are sometimes better deals (especially when you consider system cost), it depends on a huge plethora of factors. 

"
morbiusgreen,ExploreFiction,1388547355.0,*He pushed him against the wall and brutally ravaged him.*
morbiusgreen,ExploreFiction,1388547363.0,"""Has the warrior fallen?"""
megachicken289,jailbreak,1388547377.0,I'm using Alien Blue on iPhone... Would that be it?
morbiusgreen,ExploreFiction,1388547377.0,*He looked at Baeli.*
morbiusgreen,ExploreFiction,1388547394.0,"""That fine...""

*He fell into a deep sleep.*"
mlh4,MakeupAddiction,1388547396.0,"I have that Revlon! In Romantic too!! ~*Lip twinz*~

I don't know why I didn't wear lips more often! I always thought mine were too small I guess, but now that I've started, I need ALL THE LIPSTICK"
Secret_Wizard,AskReddit,1388547402.0,"**Six String Samurai**

It's a post apocalyptic 1960's America. The world is ruled by the King of Rock from his seat in Lost Vegas. But after Elvis' sudden and unexpected death, bands from around the world travel to Lost Vegas in a bid to take the throne. Not-Buddy Holly, armed with a Guitar and Katana, braves the wasteland and fights off rival bands, mutant monsters, and robots in his quest to become King. Deliciously campy.

**The Triplets of Belleville**

A dialogue-less french animated film, and one of my personal favorites of all time. After her grandson, a Tour De France bicyclist named Champion, is kidnapped by some sort of Mafia gang, the elderly woman Souza tails them to the city of Belleville. After a chance encounter with three elderly women who were famous singers in the 1930s, the four team up to rescue Champion."
sillyribbit,AskReddit,1388547425.0,Can you get rid of acne? At least after age 18 or so. This shit is getting old. 
megachicken289,jailbreak,1388547429.0,"Well, I'm on iPhone, maybe that's it?"
bananaruth,AskReddit,1388547451.0,"Still, see part two of my statement. Cars are a terrible investment. Unless cars were truly your hobby or passion, it would be a completely unjustified expense. Even if you were wealthy.

Source: My family is wealthy."
kickingturkies,AskReddit,1388547522.0,Isn't the skull already concussion resistant?
swanpenguin,CFB,1388547525.0,Could you imagine how it must feel to know we had co-offensive coordinators this season? I could only imagine the arguments they had because these styles are very different. I love how Clear is getting thrown to. He's a Junior right now. Next year could be a huge year for him.
Marilolli,AskWomen,1388547546.0,Yes look at all the downvotes we get just by suggesting we get downvotes there. That'll show the patriarchy. 
goodbyes,nba,1388547550.0,"feels good to win man, fuck tanking"
morbiusgreen,ExploreFiction,1388547551.0,*He tried something by showing her an image of a pregnant Mattie. Jon put a gun to the pregnant belly and killed the fetus.*
techlos,dogecoin,1388547552.0,"It can happen when there's a network problem with the pool. More common if you've been mining for days... usually it's best to set a script that restarts the miners every 6 hours
"
Dagoth_Draal,gmod,1388547564.0,"Hahahha, oh my god yes"
ariden,lexington,1388547564.0,"Hey sorry nobody commented, I'm spending my New Years at home tonight too. Cheers. I hope you found something good!"
morbiusgreen,ExploreFiction,1388547566.0,"""Don't tell anyone about this slave."""
morbiusgreen,ExploreFiction,1388547577.0,"""Aloise?"""
Strayl1ght,explainlikeimfive,1388547588.0,I imagine it happens because there's a nerve right there that is connected to parts in the rest of your body.
SkyB4se,videos,1388547597.0,also cats can't talk so theres that
billcstickers,technology,1388547598.0,"&gt;Amazon doesn't notice most likely as its bundled with so many other referrals

But shouldn't that be sus in the first place? Thousands of disparate products being referred by the same referrer?

&gt;a third party referral link aggregator is who distributes the money among its participants

What's with the middle man? Wouldn't such a scheme be against the Tos? And how do they know how much the ISP ""deserves""?"
Dr_Explosion,Fantasy,1388547599.0,"&gt; The one exception to this blanket warning is the book Traitor by Matthew Stover...

This book was one of the first EU novels I read, and Jacen Solo became my favourite character because of it. I was so sad that later books/authors didn't just ignore most of the character development, but they decided everything that happened [](#s ""ultimately lead Jacen to The Dark Side."")"
morbiusgreen,ExploreFiction,1388547604.0,"""Shall we take them home? Or buy a house here and live here for some of the time?"""
swanpenguin,CFB,1388547620.0,They're pulling a 2011 Texas A&amp;M.
ReasonReader,sex,1388547621.0,"&gt;another person fucking her with me or me on the side watching. 

So, she gets off on the idea of humiliating you about as cruelly as possible?n  Not just fucking another guy, but actually doing it *in front of you*?

&gt; she still wants to try. 

and she thinks you're too much of a pussy to walk away.  It would seem  that she has some reason to hold you in contempt.  Are you in the habit of letting her walk all over you?

&gt;What should i do?

Kick her to the curb.   You don't need this shit."
morbiusgreen,ExploreFiction,1388547628.0,*Seeker headed out towards the east.*
swanpenguin,CFB,1388547633.0,Snyder realized he's on the hot seat.
morbiusgreen,ExploreFiction,1388547636.0,"""We need to loosen you up."""
thedictatorscut,MakeupAddiction,1388547656.0,"[This is me](http://i.imgur.com/HMoXCnc.jpg) in KVD Light 42. I'm about the lightest shade in every foundation I've ever tried (too light for a lot of brands, actually) and it's a dead-on match. Definitely try to get your hands on it if you can."
morbiusgreen,ExploreFiction,1388547656.0,"""Very well,"" *she said, looking disappointed.*"
CowboyMikey,AskWomen,1388547662.0,"I think it's like ""ehh, I wasn't expecting this school project to end in us making out, but it's pretty boring anyhow and this is kinda nice..."" And I'm kind of innocent so I'm thinking we're going to eventually stop making out and go back to the project because it *is* due tomorrow. And he's not so innocent and thinks that's just because I kissed him, I want to have sex with him. And next thing I know, I'm in the position of turning him down for sex because even though unexpected kisses on a non-date can be nice and maybe even sweet, random sex totally isn't my thing."
fruitjerky,cringepics,1388547690.0,"The 14 minute gap between the ""hi"" and the ""your hott"" is the worst part. Jesus Christ, Samuel, get it together."
morbiusgreen,ExploreFiction,1388547693.0,"""We left him in Passageway, remember? I do not think he is here. Why?"""
MassacrMan,Texans,1388547714.0,[Me right now.](http://i.minus.com/iIcpxCoRxEBNC.gif)
megachicken289,jailbreak,1388547715.0,I'd rather just switch to a desktop for an up-to-date version. I'll try that
7-SE7EN-7,FanTheories,1388547726.0,You have to warn me! I almost got trapped forever!
RollTides,CFB,1388547731.0,This game is getting too turnt up right now.
ReasonReader,technology,1388547737.0,"&gt; Its only biased when its apple right? 

She stated her bias before the trial even began.  Look it up.

Not familiar with her other cases, but if she's so blatant about this one, she's probably fucked over several other defendants in her court before this."
kishbish,florida,1388547738.0,"I'm glad this has been struck down. It was a stupid, needlessly expensive law that criminalized the poor. Now all that's left to do is wait for the inevitable and indignant Facebook tirades of my conservative friends! "
GoldReaper,funny,1388547744.0,This guy looks like my high school calculus teacher.
morbiusgreen,ExploreFiction,1388547766.0,*A black haired beauty wearing a gray shirt with a wolf face on it stood there. Beside her stood a blond haired male with pointed ears. He wore very tight fitting girly jeans.*
swanpenguin,CFB,1388547768.0,"I think this was a hell of a game from the get go! Though, I wasn't happy for a very large part of it."
morbiusgreen,ExploreFiction,1388547780.0,*Jon raped for hours and came inside many times.*
morbiusgreen,ExploreFiction,1388547793.0,"""Just you and me for now..."""
morbiusgreen,ExploreFiction,1388547813.0,"""Want me to make milk from every humanoid furry form?"""
morbiusgreen,ExploreFiction,1388547828.0,*For the latter half he slept well.*
dackkorto1,reactiongifs,1388547841.0,My supervisor did this today...
Jlc2100,AskReddit,1388547846.0,and night vision.
morbiusgreen,ExploreFiction,1388547855.0,*He whimpered out the lesser of two evils.*
underwriter,AskReddit,1388547856.0,Meanwhile plants are getting date-raped like crazy
fruitjerky,breakingmom,1388547862.0,"My 6mo has learned to shake her head. And when I do it she laughs. Which sounds awesome, but now I can't help but shake my head to make her laugh all day long and I keep giving myself a headache. But that giggle!"
avatar_aang_,starcraft,1388547874.0,"lol.  immediately after the showmatch he started laddering, got smashed by protoss, and whined about imbalance some more."
skeelak,AskReddit,1388547877.0,This is my resolution as well.
morbiusgreen,ExploreFiction,1388547884.0,"*He looked at her.*

""Every time I showed you a death scene you never whimpered, so why now?"""
TheBlackDahliaMurder,Fitness,1388547893.0,"Technically not an isolation, but I love DB pullovers. The stretch you get in your upper back just feels amazing."
morbiusgreen,ExploreFiction,1388547898.0,*He fucked him in front of the girls.*
underwriter,AskReddit,1388547903.0,~~HEAD ON~~ SACK ON
morbiusgreen,ExploreFiction,1388547916.0,"""Nice. I'm ready to go home now, are you?"""
dackkorto1,TrollXChromosomes,1388547930.0,So is it weird if a guy owns one?
morbiusgreen,ExploreFiction,1388547933.0,"""What are you doing? I look like a wet cat."""
ReasonReader,sex,1388547935.0,RUN.
Neebat,technology,1388547947.0,It's just amazing to me how many people build a business around a type of contract (the affiliate programs all have similar terms) without understanding that their whole fucking business violates the contract.
Ehejav,AskReddit,1388547953.0,actually sharks teeth are related to their skin. sharks have no ossified bones anywhere in their bodies.
morbiusgreen,ExploreFiction,1388547953.0,*He made love anally for hours.*
DrPepperHelp,electronic_cigarette,1388547965.0,How dare you deface the master work by /u/The_Goss.
underwriter,AskReddit,1388547965.0,and here I just thought I didn't want to marry her
Jlc2100,AskReddit,1388547968.0,"He's not your guy, bro."
morbiusgreen,ExploreFiction,1388547976.0,"*In the distance a large mountain, Mt. Hood, was visible.*"
morbiusgreen,ExploreFiction,1388547993.0,"""You whimpered. Why?"""
joerobo,OrthodoxChristianity,1388547995.0,"I had heard Chrysanthes was really good, though a bit unexpected.  I didn't make it to Father Chakos' talk, though most of my group did.  Said very good things.  

I was too afraid to go to Father Radu's talk.  To be honest, I'd have some problems with what he said, so it seemed a little counter productive.  I'm glad to hear he made his case well though.

Bishop Gregory is exactly what OCF needs, I couldn't agree with you more.  He also seems to appreciate the virtue of brevity, which is sadly rare amongst Bishops.  

Just got home.  600 miles on the road, the last 200 through a blizzard.  Truth be told, it was quite pretty.  I'm used to snow driving.

Of course, thanks for putting this all together.  Without you we would have sat at home doing nothing, like everyone else."
morbiusgreen,ExploreFiction,1388548007.0,"*Trembling, he licked.*"
Ewrong,gifs,1388548011.0,"Kemper, a suicide girl."
swanpenguin,CFB,1388548019.0,HELL YEAH.
ReasonReader,technology,1388548024.0,"&gt; It's called a wheel conspiracy. 

Bullshit.  There is no conspiracy to fix prices, every publisher sets their own.  Apple's entry into this market broke a monopoly, and it's nothing short of asinine to pretend that they reduced competition for e-books."
morbiusgreen,ExploreFiction,1388548027.0,*He woke later than usual.*
SkyB4se,videos,1388548040.0,I remember my elementary school had constant skunk attacks near the mobile classrooms. Though I never saw any skunks. The janitor was probably just smoking pot.
morbiusgreen,ExploreFiction,1388548044.0,"""After you cum inside me tonight, I need sleep."""
bananaruth,AskReddit,1388548057.0,"I look for a smart guy who likes dogs, respects me, and has a similar worldview. A sense of humor is also a must. Physically, I don't mind if the guy is very fit, but I do prefer him to be on the skinnier side.

It's really all personal preference. The fact that you ever perceived women to be ""falling at your feet"" is a definite turn-off for me. "
morbiusgreen,ExploreFiction,1388548058.0,"*He held her for hours, not doing anything sexual.*"
Eggfibre,TestOutfit,1388548070.0,"Happy new year. You guys are some of thr brdt I've ever played with. I know I haven't played alot recently, but I will certainly be coming back more often. Its a shame you damn americans have differnt timezones and stuff, or id play more witht yout huys because yout cool,"
thedictatorscut,AskMen,1388548102.0,"I know at least three girls who claim to have hooked up with Darren Criss in college, though I only believe one of them. (I didn't go to UMich, but most of my friends now did - that's what happens when you hang around with musical theatre people all the time.)

Also, Walt from Lost hit on me when I was 15. That's a whole story in itself."
morbiusgreen,ExploreFiction,1388548110.0,"*Kiiven saw Bryllana approach.*

""Madam Cancian?"""
swanpenguin,CFB,1388548111.0,They better watch for the onside kick.
PacDan,JusticePorn,1388548116.0,Damn dude you're late to the party. 
morbiusgreen,ExploreFiction,1388548130.0,"""Your seed and mine are mixing..."""
DrPepperHelp,ecigclassifieds,1388548132.0,I have always wanted to try a fogger.
GoldReaper,gaming,1388548145.0,"Happy New Year to you too, danrobson1 "
MassacrMan,AdviceAnimals,1388548151.0,http://i.imgur.com/HDZS12B.gif
Herra_Ratatoskr,AskReddit,1388548170.0,"I didn't really want to go to graduate school, I just didn't want to face the real world."
lurker6412,AskMen,1388548174.0,Play whatever your friends are playing imo. Those kinds of games are better when you have friends to play with.
RollTides,CFB,1388548177.0,What r u doin Dook?
billweasley,CFB,1388548186.0,I'm amazed that these announcers can talk so clearly with Johnny manziels dick so far down their throats
dackkorto1,pics,1388548190.0,"I dont get this generation, whats with the tights, yoga pants, and leggings? "
skivian,FanTheories,1388548205.0,Nibbler used alien tech to do it. 
mancl692,gaming,1388548207.0,Not even hundreds. More like thousands of people.
eighthgear,anime,1388548217.0,"[insert MC dense as ironwood joke here]

Oh wait, that was a joke in it of itself. I think the fact that I've watched all of IS and IS 2 is a joke as well. As is the fact that I will undoubtably watch whatever IS comes in the future. I swear, that series is absolutely awful, yet I keep on watching it. Am I an IS tsundere?"
FrankReynolds,hockey,1388548221.0,Anyone have video of the call he's angry about?  I missed this game.
Jlc2100,AskReddit,1388548228.0,This is really a thing?
kishbish,Foodforthought,1388548238.0,Too bad. Would have been fun watching the Ayn Rand acolytes shit themselves at the thought of someone getting to read *Atlas Shrugged* for free. Public libraries are bad enough in their eyes. 
wizardlegs,Fighters,1388548241.0,"Conceptual things like footsies and spacing carry over. Execution is a really  big thing though. Most people just pick up a fighting game and mash like crazy, you never get better doing that. If you've taken time to practice execution, and practice hitting the buttons you want to hit, instead of just going ham on them, that will translate pretty well from game to game. Just generally being in control of what you are doing, even if you don't have great fundamentals yet. If you're pretty decent at SC2 and can get your character to do exactly what you want it to do, you should be able to pick up characters in other games. And it only gets easier the more you do it.

There is still going to be some level of transition to any new game though. Different games/characters react to buttons in different ways, or have different paces and such, different execution techniques and so on. But still, if you're not mashing, you're already on your way to being in control of what you're doing. That can go pretty far in picking up new games

Each game is going to have its own set of rules though. Just little things, little bits of game engine or character knowledge. Nothing really speeds that up except getting experienced with a particular game, and developing habits for various games. Easy example is jumping in Marvel and being able to block, then going to Street Fighter and getting blown up for jumping. It's just a 'rule' you have to learn, among many others across different games. Alternatively though, if you can hit a lot of the best combos in Marvel with general ease, you can probably pick up Persona 4 combos fairly quickly.

At least that's how I've experienced fighting games over the years"
Ewrong,WTF,1388548246.0,"Technically, yes. Dogs Implies multiples. Dog's implies ownership. Dogs' implies both."
morbiusgreen,ExploreFiction,1388548247.0,*He decided to share a dream with her.*
morbiusgreen,ExploreFiction,1388548256.0,"""Fuck me in the ass now!"""
NotSquareGarden,nba,1388548259.0,"This is probably a really stupid question and everything, but why isn't Wilt at least part of the conversation? I mean, the guy owns practically every NBA record, doesn't he? "
morbiusgreen,ExploreFiction,1388548263.0,"""Yes?"""
morbiusgreen,ExploreFiction,1388548274.0,*She shook her head and purred.*
morbiusgreen,ExploreFiction,1388548290.0,"""Then choose one and fuck them senseless."""
morbiusgreen,ExploreFiction,1388548304.0,"""Moan for me Baeli! Like the bitch you are!"""
morbiusgreen,ExploreFiction,1388548328.0,"""Your nethers want my attention?"""
Ninja_Please117,AskHistorians,1388548359.0,"I really like that analogy. I'm not sure how accurate it is, but It fits perfectly well for describing their utility on the battlefield relative to whatever weapons your opponent is probably wielding. "
morbiusgreen,ExploreFiction,1388548361.0,"""It is called Mt. Hood. It was called that even in the days of the Seraphs."""
morbiusgreen,ExploreFiction,1388548371.0,"""Why does death excite you?"""
i_hate_toolbars,CFB,1388548376.0,Please don't put that evil on us...
morbiusgreen,ExploreFiction,1388548388.0,*He gasped and complied.*
TronCorleone,AskReddit,1388548400.0,You don't exist
morbiusgreen,ExploreFiction,1388548416.0,"""And the secretary downstairs? You want to take all three of us home don't you?"""
shiv4m,cars,1388548429.0,Couldn't she just pay the tax through the money she just won with the car?
dackkorto1,nostalgia,1388548437.0,go get them developed at a CVS or Walgreens
bayernownz1995,hiphopheads,1388548440.0,Yeah but the VW sound is almost the complete opposite of Danny's
AwesomeLandia,tall,1388548470.0,I immediately think of the leg coming off in Death Proof.
morbiusgreen,ExploreFiction,1388548470.0,"""I am Juliana and this little guy is Faeian."""
dackkorto1,TrollXChromosomes,1388548481.0,"Well not really what I meant lol, I mean if a guy whipped out to use on a girl."
morbiusgreen,ExploreFiction,1388548482.0,"""In the back, why?"""
ReasonReader,AdviceAnimals,1388548491.0,Please tell us you kicked his ass.
morbiusgreen,ExploreFiction,1388548506.0,"""Drink it then.""

*He pushed Baeli's head into the white liquid.*"
Manly-man,videos,1388548509.0,Terminator as fuck
keypuncher,conservatives,1388548510.0,"There won't be any.

Conservatives already detest MSNBC, liberals won't hold them to account for it."
printzonic,AdviceAnimals,1388548511.0,"cool
"
morbiusgreen,ExploreFiction,1388548526.0,"*Jon took the place of the dream version.*

""Why a large me?"""
babuchas,AskReddit,1388548545.0,I like to whore karma with true stories and relevant ocasions
morbiusgreen,ExploreFiction,1388548551.0,*She let him squeeze her soft leathery tits.*
bananaruth,AskReddit,1388548553.0,"No. It really doesn't. What paying for a date gets you is a chance to get to know a person. That is all you get for your money. You are being nice, that's it.

If you asked someone out, you should pay. That person would probably be enjoying a meal at home if you hadn't. They took the risk of saying 'yes' to you. This is generally more risky for women, especially if they don't know you. 

All this being said - I always try to pay for first dates because I don't want any man to feel like I owe them anything. "
RollTides,CFB,1388548558.0,"Johnny is the main reason this game has the ratings it is getting, of course they are going to milk it."
kickingturkies,knifeclub,1388548568.0,"I mean the grind, weight, etc.

What makes an axe split better?"
Mr_Sly_G,southpark,1388548571.0,Fack You Mongorian
avatar_aang_,tf2,1388548584.0,He made soooooo much money off this.  Peaked at 140k stream viewers and he was spamming ads the whole time.  Plus people subbed for some reason.
Dagoth_Draal,JenniferLawrence,1388548585.0,"Oh wow, I had no clue."
morbiusgreen,ExploreFiction,1388548586.0,"""Oh? You know how to make a lady shiver down there."""
RollTides,CFB,1388548610.0,"If at any point you see Evans with man coverage, you throw it to Evans."
morbiusgreen,ExploreFiction,1388548611.0,*He sat up. His fever was still there but it had obviously gone down.*
pressthebuttonfrank,AskReddit,1388548632.0,Band /electronic shop loner.  Pretty much the same but now with a couple of engineering degrees and a few decades of experience.  Still friends with some of the folks I knew in high school.
morbiusgreen,ExploreFiction,1388548632.0,"""Bubbles bubbles everywhere..."""
morbiusgreen,ExploreFiction,1388548645.0,*Jon pushed in deeper and made his member grow.*
ReasonReader,technology,1388548660.0,"&gt; Every publisher happened to set the exact same price

Not true.  Go look at some prices on iBooks right now."
swanpenguin,CFB,1388548661.0,WHOOP!
NotSquareGarden,nfl,1388548678.0,At least you can grow a beard. I will have to face reality of living my entire life without one. Consider yourself lucky. :P
C_Eberhard,AskMen,1388548682.0,Are you aware of the quoted movie?
keypuncher,conservatives,1388548684.0,"&gt; No, I am not going to explore for ages in that site to find your facts.

I'm sorry that clicking on Michigan on the map was too difficult for you.

&gt; Do you claim that premiums are the only aspect of insurance or health care costs? 

Not in any way.  Most people are seeing higher premiums, higher deductibles, AND higher out of pocket costs once the deductibles are met, all at once."
Angry_Apollo,AskReddit,1388548687.0,This is the one I've heard. I have no science to confirm anything though.
Jlc2100,AskReddit,1388548704.0,Water cooled bby...
Tazato,anime,1388548721.0,[WHAT NONSENSE IS THIS?](http://i.imgur.com/SW3DWlR.jpg) 
dewprisms,changemyview,1388548722.0,"There's no clear cut answers, but if you feel like your life is in danger because you get slapped once, you may need to adjust your assessment of situations, for example. I personally would try to restrain before hitting back, and would only begin fighting back if I feel like I am in serious danger of grave injury."
Monofu,rails,1388548736.0,"The first solution is the way to go. There's no need to have a separate model for each attribute. 

I'd recommend working through Michael Hartl's Rails Tutorial which helped me immensely when learning Rails. "
someuniquename,AskReddit,1388548737.0,"My brother is asshole on the internet. Well one day he gave our address out to some kids threatening to hurt him. Well this time he actually came over and with about 12 other guys. We called the cops because of some things said such as ""better put your vest on"" and ""you won't say shit with the rifle in your face."" Well we found out they actually brought a shotgun. Cops came in and red the whole thing and I was trying to take a picture to show a friend because he didn't believe me. FLASH WENT OFF! I'm like i hope he didn't see it. He did and he just laughed. "
