author,subreddit,created_utc,body
MidnightSlinks,AskWomen,1388539510.0,"I'm fine with not owning any non-practical items, but some minimalists cross the line. They invite a girl over, but only have 1 pillow on the bed. Their ""bed"" is a futon mattress on the floor. The only towel to dry my hand/face on the same towel he dries his taint with. If your house/room screams ""I refuse to own more things than are required for a single person to subsist on"" then I won't want to stay there. It's the same as how you should have dishes, utensils, food, and a place to sit if you're going to invite someone over for dinner.

But that wouldn't be a deal breaker. I've dated guys with shitty living situations and we just stayed at my place. My only real beef with minimalists is when they don't have enough stuff (see above complaints) to comfortably host an overnight guest and they blame it on the ""materialistic woman"" for not ""getting"" or ""respecting"" his lifestyle."
AlfredHawthorneHill,nonononoyes,1388539527.0,Why not Zoidberg?
MaeBeWeird,GrandTheftAutoV,1388539529.0,"He's the keeper!

(Im the seeker)"
DeRanjed,cigars,1388539535.0,"I'm currently swinging back from larger gauge cigars too but at the same time, I get to smoke a cigar maybe once a week if I'm lucky (though the holidays have given me a bit more smoke time). 

Therefore I treat smoking as a mini vacation and devout as much time as possible to it so I like to longer/bigger gauge cigars which give me 2-3 hour smoke time rather than just an hour and a half.

On a side note, I was in my B&amp;M on a Friday night recently and it was absolutely dead and I was shocked by it and as I talked to the person behind the counter I came to the realization that the reason was that cigars are a treat and a nice thing for me whereas their regulars are just that, regulars, so the store is packed during the days/early night times but people would rather do other things at night. 

There's no real point to my story because I know other B&amp;M's are quite the opposite but it did make me realize the differences in why people smoke makes a big difference on when and what they smoke."
morbiusgreen,ExploreFiction,1388539541.0,"""Your boss sure knows how to decorate!"" *Flavul said as she let the water run down her slightly pale but perfect skin.*"
IBiteYou,conservatives,1388539562.0,"If you read the comments in order, maybe that will help you understand the conversation."
outcast151,whowouldwin,1388539569.0,the green lantern corps would probably get wrecked considering the antispiral are groomed to kill that sort of power and can seriously fuck shit up in both physical and metaphysical combat
itsjusttoored,AskMen,1388539573.0,In primary school a girl used to gallop around the playground pretending to be a horse. She was the pretty blonde one too.
jawookie,nfl,1388539592.0,"I'm gonna go pure NFL style here and call him our OPOY.  Charles has the flash, but Smith is the one who has really kept us in games.
"
Gnill,edmproduction,1388539610.0,Ah ok
OctaVariuM8,nfl,1388539618.0,"If you're like me, it means he'll get traded. BGE, Woodhead, Moss :(. "
keypuncher,Republican,1388539624.0,"&gt; OK then, why would the US government give this theoretical mincome to workers.

No idea.  It would be a bad plan to give it to anyone.

&gt; Surely the idea of a mincome is to bring everyone up to that level by paying those that aren't there already, not by just doling out the dosh?

It depends on who you ask.

&gt; I also think the negative income tax, as laid out in the article back up my point of view, it would just consist of tax brackets where you get money rather than pay it.

[We already have that.](http://taxfoundation.org/blog/maybe-rich-can-afford-pay-more-tax-should-they)"
SumoG60,Hotwife,1388539640.0,I volunteer to be the fifth guy. I'll make sure to take a weekend off just to see you! 
Perspective133,AdviceAnimals,1388539644.0,"Do you actually want to know this information, or are you just making random ""facts"" up in order to support you position?"
S7evyn,mylittlepony,1388539647.0,Dudra looks like a stoner. Maybe it's the beanbag. Looks like he'd be a cool dude to hang out with though.
12sea21,LifeProTips,1388539651.0,"&gt; This is often acknowledged by the writer, and is a form of trolling – meant to lure people who are new to internectual cultures to it’s demise.

Hhehehehe"
goldy_locks,BabyBumps,1388539660.0,You shouldn't have to hide your medical history from doctors that have no bedside manner. 
ABKC,AskMen,1388539676.0,"That's a bullshit metric, one people would not consider when you present it as making whites a minority, and you know it."
kornberg,sex,1388539695.0,"When I had libidio issues, I cared about it. I cared that my husband felt rejected or not good enough for me and I missed being able to enjoy being close and intimate with him. I did everything I could to be close to him, even if it wasn't super exciting to me at the time because I was happy to be able to make him excited in the ways that I could. I also saw doctors and therapists for over a year before we finally checked my thyroid, which was low and the rest is history. 

The OP isn't describing someone who gives a shit about her SO--he's describing an entitled person who is taking her SO for granted. She expects him to stick around no matter how badly she treats him. They are supposed to be partners and she doesn't care about picking up her end of the slack. *That's* the problem, not her low libido."
FrankReynolds,hockey,1388539706.0,"That sounds better than ""ended 2013 with six straight regulation losses and 0 regulation wins since December 8th."""
SumoG60,Hotwife,1388539723.0,I need to visit Tampa. You're wife is amazing and looks great.
morbiusgreen,ExploreFiction,1388539723.0,"*Her eyes widened at that. She stammered,* ""W-w-well, um...anything else ab-about youself?"""
ProtoKun7,gallifrey,1388539727.0,I detect the similarities to other tracks but I don't recognise it as a separate entity; I think it might be a new track.
masturbateawy,RedPillWomen,1388539738.0,"My husband's mother is tall 5'9"" and fairly slim she weighs a bit more now but has always be very thin. He likes them short and curvy and loves a woman with a small waist and wide hips. Not that he would kick a woman out of bed for being slim but that's his thing. "
jawookie,nfl,1388539738.0,"DPOY is a tough one.  Without the injury I would absolutely have to give it to Houston.  Also, since our D has struggled since his injury, I really think it shows how important he was to us.  Poe is an absolute beast, and I don't at all discredit his work.  Then we have Derrick Johnson as our on field general.  He also makes everyone around him look better.  I don't think there's any easy answer for our defense."
AlfredHawthorneHill,WritingPrompts,1388539745.0,"Oh, you young'uns.  It certainly is outdated now by virtues of its 1980s technology and references but I hope that this movie, unappreciated even in its own time, still might resonate with you."
clockworkgirl21,WTF,1388539749.0,Both are intact. Look closer.
swanpenguin,CFB,1388539761.0,"What exactly is the ""bend, don't break"" defense mentality? I've been hearing a lot about it lately. "
IAmNotAPerson6,funny,1388539770.0,"""And what happened, then? Well, on reddit they say - that the subreddit's small number of subscribers grew three sizes that day."""
sam_hammich,worldnews,1388539772.0,Then you take up the fight.
pamplemus,TwoXChromosomes,1388539773.0,"with my husband and my two little sisters, aka my favourite people in the world :) we're going to be cooking dinner together and then watching a bunch of netflix. probably parks and rec because it's awesome. especially perd &lt;3"
semen_slurper,short,1388539774.0,Yoga is amazing and so much more difficult than people realize!! And I just realized that my yoga teacher is a very short man and one of the most amazing people I've ever met! He can literally do a handstand from just about any yoga pose ever. I could go on about him for days. 
goldy_locks,BabyBumps,1388539780.0,I wish I was all dolled up and partying but I think the weather this year has kept the party scene at a minimum :(
snazztasticmatt,trees,1388539809.0,"You know, I know a guy who's driven drunk multiple times and hasn't been in an accident or been arrested.  That does NOT warrant the behavior.  You can't defend yourself for driving high because the universal known fact is that driving under the influence of almost any drug is dangerous.

Your driving record plays no part in the crazy shit that will happen on the road in the future.  When you're stoned, your reaction time is impaired, you are easily distractable, and you have the capability of killing people.  You can keep doing it all you want, but stop fucking encouraging it."
semen_slurper,short,1388539839.0,Aren't most female celebrities pretty short?
michaelkeene,bicycling,1388539858.0,"Too bad they ran out of space to print the follow up ""Young Maid Drops Carbon Transmitter, Exits To Great Commotion"". "
clockworkgirl21,WTF,1388539864.0,Both are intact.
Heelincal,nfl,1388539876.0,Yep. Helps with parity.
cluberti,sysadmin,1388539878.0,"Well, I already use DPM in other places, so the use of DPM was an easy one.  You *need* to license System Center to get access to DPM (as it's one of the components), so in general it makes sense to use DPM if you're already planning on looking into SCVMM, SCOM, SCCM, etc.  If you already have products to handle lifecycle management, virtual machine management, environment monitoring, etc., Altaro may be an easier decision because it usually ends up cheaper when compared directly to only DPM (due to the system center overhead that acquiring DPM may incur if you don't have a VL deal with Microsoft already)."
James_GAF,worldnews,1388539883.0,"The ozone problem as I remember it was one of higher exposures to UV light which could lead to higher rates of cancer and fatal exposure to plants as well as some animal species. There's a faux commercial in one of the 80s action movies(the running man maybe?) where a woman covers herself in thick blue goop to lay out in the sun. That was the ozone problem.

In the here and now you seem to be conflating high atmosphere ozone depletion, the CFC related problem largely of the past, with low atmosphere GHG effect of ozone."
PcaKestheaod,starcraft,1388539887.0,He looks like such a genuine nice guy. He looks like the kind of guy who's great to have a laugh with.
Chap82,brisbane,1388539901.0,"Count me in to do river loop today.

"
Sahil17,Christianity,1388539904.0,Do you have a source of Revelation barely making it in? That'd be a very interesting read.
laxincat11,hockey,1388539906.0,Went from should've been up by 1 to down by 2 real quick...
LonleyViolist,gifs,1388539907.0,Shit what's that from??
jawookie,nfl,1388539915.0,Knile Davis has been decent.  Even outside of last weekends game.  As long as he watches the fumbling he is a strong runner and he's been good in the return game.  If we're looking at our own draftees then Davis is the winner out of that group.
TheWindyCity,NoFap,1388539932.0,"* No

* No

* Yes but only through sexual experiences with another person

* I feel that regular masturbation has an adverse effect on your dating and sex life. In many ways I feel like its a crutch and enables you to put off seeking out legitimate relationships and sexual experiences with another person."
Bilgistic,AdviceAnimals,1388539957.0,"No, I didn't. Notice his [comment](http://www.reddit.com/r/AdviceAnimals/comments/1u3hri/im_in_south_carolina_and_this_just_happened_to_me/ceebgng?context=3) right before the submission;

&gt; Africans sold Africans into slavery and they are mad at Europeans? They should get over themselves.

In his mind it's just something to get over, which is why he posted this to make himself feel better."
YLXV,funny,1388539959.0,"Ok, then in this case, why is OP posting a comic telling us how to live? What's it to you? Let me live how I want"
JHemingway,AdviceAnimals,1388539962.0,"It was indeed one of my exes. One of those I don't want to talk again, but was nice anyway. (:"
semen_slurper,tall,1388539962.0,"I've never had someone break up with me because of my height but I've had plenty of fellas not want to date me because of it. Some men are just insecure about their height and won't date a taller woman (which sucks because I am really into shorter men.) But my current SO is 5'6"" and he is the most confident man I know :)"
yarnskeinporchswings,knitting,1388539966.0,"Put that in perspective and it becomes obvious why he feels taken advantage of. If I left and couldn't take everything with me, I'd leave the old 70s acrylic I've accumulated, the Red Heart Super Saver...I could probably find a good 17 pounds to drop. This girl left GOOD stuff behind!

I'm growing a conspiracy theory in my head...the guy who posted the ad isn't Tom, he's [Ryan Gosling](http://www.pinterest.com/pin/254383078924344529/)."
S7evyn,mylittlepony,1388539976.0,"[Aluminum](https://www.youtube.com/watch?v=W_PTMfXmLR0) to me

[Aluminium](https://en.wikipedia.org/wiki/American_and_British_English_spelling_differences#Different_spellings_for_different_pronunciations) to some

You can shine like sliver all you want

But you're just Aluminum"
morbiusgreen,ExploreFiction,1388539991.0,"*Flavul smiled. She looked around for cleaning implements, found some and began washing herself.*

""Next you'll be telling me you have a sauna and Jacuzzi."""
Perspective133,AdviceAnimals,1388539992.0,"Is that because the truth of the matter conflicts with a world view you've held as fact for many years?

Like I said, to say that the African slave trade was the ""worst"" form of slavery ever is an extreme statement, given the fact that slavery has existed more or less since the dawn of mankind.

http://en.wikipedia.org/wiki/History_of_slavery"
Jess_than_three,atheism,1388539993.0,"1. You're responding to something I didn't say. I'm saying who gives a shit about their *textbooks* when they have so many other worse problems? In the US, and the rest of the West, absolutely, yes, let's get up in arms about those things - because we aren't *living under the rule of a religion*. I didn't say anything about ""giving anyone time"" for anything; I'm talking *priorities* here.

2. I love how fucking intolerant /r/atheism is. Yes, absolutely, all 1.2 **billion** Catholics are ""horrible people"". Absolutely. Also clearly the people I've met who have called themselves Catholics have apparently either secretly been horrible people, or have in fact not been Catholics. Who knew?"
SumoG60,Hotwife,1388539999.0,Best of luck. Hope it all goes well for both of you! And have a safe and happy New Years. 
DeRanjed,cigars,1388540010.0,"I think that it's an amazing thing that they did and it's a really smart idea for a start-up to do to get their name out there and to do something different with the leaf samplers.

Interestingly enough though, I was watching the videos posted by /u/ranger_bob69  [(link here, video 4 I think is where he specifically talks about it)](http://www.reddit.com/r/cigars/comments/1sf02q/people_are_complaining_that_they_want_better/) and Pete Johnson of Tatuaje states that it's just not very feasible to do this on a larger scale because product is so scarce as it is. 

Now I don't take that as gospel and I'm sure for some companies it would work and some it wouldn't but it's interesting that those videos are from 2012 so the idea was already out there in the market and dismissed... by Tatuaje at least.

Overall, I still hope you are correct, I just found it interesting and wanted to plug those videos because they were enjoyable to watch."
Neebat,AskReddit,1388540015.0,"I give Mountain Dew credit and blame for my diabetes diagnosis.  I was pissing so much (diabetes does that) that I was thirsty all the time, so I drank more Dew.  Sometimes as much as a 12 pack a day.

I finally complained to my doctor about getting up 3 times a night to piss.  Getting tested for diabetes is DEAD SIMPLE, and the results are instant. He wouldn't let me leave the office until I had an appointment scheduled with an endocrinologist.

I stopped all softdrinks that day, and controlling the diabetes has been very easy for me.  I'm not nearly fat enough to get type-2 without a genetic predisposition, but I could have lived another 20 years without symptoms if it hadn't been for Mountain Dew."
ardenbucket,dogs,1388540019.0,"Mine are! 

I have a high energy, drivey shepherd-collie mix, and a low-medium energy Chinook pup. We live in a 550 sqft one bedroom apartment. And they're totally fine.

Granted, I enjoy walking them between two and three hours a day, and most of that is off leash at a nearby park. I love the exercise and time in the sun, and they thrive on the extended play time and socialization. So when indoors, they're zonked. I doubt they make much use of the space beyond the couch, their beds, and my bed. Company tends to be taken aback at how chill they are. 

In my opinion, dogs are happiest so long as they're on a schedule and they get time with you. All of my dogs have pretty much been apartment dogs since they were pups, and none of them have been small or particularly low energy dogs.

I think what you're proposing is realistic. You clearly care for your dogs' well-beings, and space is only one manifestation of that care. I think you're well in the clear. "
GuruGrendo,newtothenavy,1388540020.0,"I see. I dont want to be a common rating. Ii want to do something that is in demand with not much people in it. 
From the people  ive been talking with apparenty IT is super common. CTN seems like what I want. "
ga4a89,todayilearned,1388540043.0,Ffffffffffffffffffffffffffffffffffffffff
Picodick,Christianity,1388540063.0,Well said. 
morbiusgreen,ExploreFiction,1388540074.0,"""Ah, well, I have no memories from before I was sixteen. I was found wandering the streets of a northwestern town. A equine and bovine couple took me in on a farm near the town."""
cardboardtube_knight,cringepics,1388540083.0,They are if you shoot everyone with them. 
paintedcones,Bass,1388540088.0,"As one of my old band mates put it, ""I'm a folk musician, I don't have to know shit""

There's no excuse to not use a metronome, and when/if OP starts recording or playing with other people or even trying to do scales at a reasonable tempo, they're going to be wishing that they had started using a met from day one. "
Bilgistic,AdviceAnimals,1388540088.0,"It isn't really. OP wrote [this](http://www.reddit.com/r/AdviceAnimals/comments/1u3hri/im_in_south_carolina_and_this_just_happened_to_me/ceebgng?context=3) right before he made this submission;

&gt; Africans sold Africans into slavery and they are mad at Europeans? They should get over themselves.

It seems awfully convenient to point this out otherwise."
allihaveismymind,nethack,1388540099.0,"baconperson got it. But this reminds me, I always play females, pretty much for the sole purpose of turning to a c and laying 200-250 eggs... maybe it's time I really did that?"
morbiusgreen,ExploreFiction,1388540099.0,*Flavul's jaw dropped. She looked at Jen and motioned her over.*
andadobeslabs,AskReddit,1388540100.0,"went shopping, couldn't find the shoes i wanted. came home and browsed reddit for like 5 hours. took a shower, and am now in the process of getting shitfaced alone in my bedroom."
cluberti,sysadmin,1388540101.0,"I guess it depends on what you plan to do with your career - after doing the same thing for years (and some time on my own as well), I ended up applying and taking a job at a company that allows (even encourages, to a point) such mobility inside the company itself.  Not sure what I would be doing now if I hadn't taken this job a decade ago, but it'd probably be back into the consulting/architect role where I'd have influence on the design, implementation, or (re)architecture of a solution, but working with the folks who know their environment inside out to make sure it works and is useful within that environment.  I've also specialized into a very few areas and gone deep versus trying to be the jack of all trades, because as a consultant or architect, that knowledge in those specific areas is what pays the bills and keeps the days interesting."
snazztasticmatt,trees,1388540111.0,"That isn't a logical retort, but more of a weak analogy.  You very well know that caffeine doesn't impair most peoples' ability to drive, or do anything except sleep.  Comparing caffeine to weed is a fallacy that will get you no further in the argument and no more respect from the person you're arguing with."
Bilgistic,AdviceAnimals,1388540126.0,"I think he's using ""poor"" in the sense of someone needing sympathy, not someone who is financially in a bad situation."
pamplemus,TwoXChromosomes,1388540136.0,"you're right that the employer doesn't have the right to demand a specific doctor's note, but if op is living in an at-will state, the employer has every right to fire the employee if she fails to provide one"
andadobeslabs,AskReddit,1388540137.0,leftover vodka mixed with mountain dew!
swanpenguin,CFB,1388540139.0,The receivers should be on the sidelines having the back-up QBs throw 'em footballs to catch. They really need to start making the catches. 
Jess_than_three,funny,1388540148.0,GFY. 
billcstickers,technology,1388540156.0,"Nope. Refer links are just amazon.com/productwhatever**&amp;refid######**. Anyone can setup an account and get their own refid, then all you have to do is slap it on the end of any amazon link on your site. I suppose an ISP could legitimately have referrals to routers or other networking stuff that they recommend but don't sell or support. You'd think amazon would monitor for sudden spikes or lots of products with no noticeable connection but it's probably too much work for little return.    "
cryss12,AbandonedPorn,1388540164.0,You better not be lying OP! 
LonleyViolist,gifs,1388540196.0,Thought so... Thanks!!
andadobeslabs,AskReddit,1388540199.0,going to NYC (during the gov't shutdown so i had an excuse not to do stupid touristy things) for the week between my summer semester and my fall semester.
Neebat,AskReddit,1388540228.0,"If you choose the drums, please don't choose the witching hour."
ProtoKun7,doctorwho,1388540233.0,"&gt;This should cause Gallifrey and the Time War to break through and resume, no?

It's only Gallifrey on the other side; there's no war anymore.

The Doctor speaking his name was intended as a confirmation that they should come through; they had the ability all along. The fact that the Doctor did not give his name made it evident it wasn't safe to come through, even though what Clara said was evidently good enough to prove that the Doctor they wanted was there."
ReasonReader,AskMen,1388540236.0,"&gt;  what I really want is feel wanted

You're not going to get that from a hooker.  If you really want to feel wanted, get a puppy."
clockworkgirl21,WTF,1388540247.0,Kudos to you!
morbiusgreen,ExploreFiction,1388540265.0,"""It can get...steamy in both places, right? *Very* steamy.""

*She licked Jen's ear gently in front of Robbie.*"
23skiddsy,science,1388540280.0,"Part of it was learning on my own time. I focus in zoology, and mammals in particular, so it's just something I read a lot about casually. I'm the kind of person to pick up non-fiction animal books in the library and read them cover to cover. 

We did discuss it a little in a mammalogy course I took. I heartily recommend taking mammalogy to anyone. "
andadobeslabs,AskReddit,1388540281.0,my favorite of the year is probably Clarity by Zedd
clockworkgirl21,WTF,1388540281.0,Both the German Medical Association and the Dutch Medical Association don't approve of doing it. Many docs from the German Medical Association even backed banning it for infants when the issue came up.
morbiusgreen,ExploreFiction,1388540296.0,"""Nope. I just had a piece of papyrus of all things with my name on it. Salfax Usoda."""
brain4breakfast,polandball,1388540303.0,"Oh, *that's* why they were missing!"
CynicalCorkey,AdviceAnimals,1388540319.0,You started a Reddit account on new years eve?
swanpenguin,CFB,1388540328.0,That's the defense I know and love. ^:(
Woozl,asoiaf,1388540344.0,"I really love how ""girl"" is on the rise. It is the perfect word to represent the combination of Arya's facelessness and how her experiences as Arya (Syrio especially) will never truly be lost."
Sahil17,Christianity,1388540353.0,"Not /u/amanitus but here's my take:

Under the reign of President Barack Obama, the sinful state of Colorado issued the legalization of marriage between one man and one man, and one woman and one woman. In the same year, the sinful state issued the passing of the use of Cannabis. Thus the prophecy had been fulfilled:

""If a man lays with another man he shall be stoned""

-Book of /u/Sahil17

Sorry Colorado you guys are actually pretty cool"
dosenga,buildapcforme,1388540354.0,Uh...I think you missed the reply button
ReasonReader,AskMen,1388540361.0,"&gt;How do you guys feel about this?

If it works for them, who am I to object?

&gt; would you ever look for a wife abroad if you couldn't find the type of woman you were looking for in America?

I see no reason to confine myself to one country."
laxincat11,hockey,1388540362.0,WOOOOO
brain4breakfast,polandball,1388540362.0,Please remove reaction gifs. It is not something we like in this sub.
jawookie,KansasCityChiefs,1388540379.0,"Haha, that was my suggestion.  Probably my biggest contribution to this subreddit."
