author,subreddit,created_utc,body
Shamus_Aran,mylittlepony,1388534404.0,I don't think we'd get nearly as much fanfiction and pictures shipping Ban-Ban and Lyro. Just saying.
Riddance,sex,1388534405.0,"Thanks. I made it up, that's how I got over my first heart break. "
Secret_Wizard,DragonsDogma,1388534416.0,"Are you sure you aren't confusing Cyclops (the easiest boss monster) for Ogres? I'm talking about [these guys](http://i.imgur.com/c3YKPdI.jpg)

Maybe I'm just a bad player... But every time I faced one on my first playthrough, all my pawns ended up getting to 0 HP at least once and I could barely get an attack in once it started berserking."
Penultimatum,malefashionadvice,1388534419.0,dont do this to me bro
7-SE7EN-7,todayilearned,1388534436.0,That's what we do when we can't find a mate
Sahil17,Christianity,1388534463.0,"Damn I love this question. Here's what I think:

* Church Fathers and earlier heresies (i.e. Gnosticism, Marcionism, Arianism etc...). Also including arguments Church Fathers held for the true Christianity. And it'd be awesome if there was St. Nicholas laying the smack down on Arius. 

* Persecutions of Christians

* Constantine's conversion and legalization of Christianity

* Ecumenical Councils 

* Charlemagne (and some his ancestors such as Pepin the short)

* Justinian's Hagia Sophia and how he said something along the lines of ""Solomon I have surpassed you""

* Islam and Christian-Islamic Tension

* Great Schism of 1054

* Crusades

* Inquisition

* Great Western Schism (Anti-Popes and the true popes) and the Council of Constance

* The ""Renaissance popes"" that weren't known for being too great...

* Martin Luther (views on him would differ since Catholics, Orthodox, and Protestants would disagree)

* King Henry VIII and the rise of the Church of England

* Council of Trent (if it was a Catholic Bible)

* Napoleon

* Nazism, Fascism, Communism and the Christian response

* Maybe some Gandhi

* Vatican Council I and II

* Catholic Church's sex-abuse scandal 

* Also some false teachers like Harold Camping

* Stuff about atheists over the years (Voltaire to the ""new"" atheists such as Hitchens, Harris, Dawkins) 

* Homosexuality and Abortion (Roe V. Wade)

That's all I can think of off the top of my head, but there's probably a lot more interesting historical events. "
spyfer,NetflixBestOf,1388534465.0,"Sorry about that one post btw lol. I hope it didn't cause you guys too much trouble. I just wanted to bring up an issue I thought needed to be changed. I do get just because it was upvoted it shouldn't be changed, because a lot of people just upvote without thinking. I still think there needs to be a limit but thanks for trying to change the repost rule even if it doesn't get changed :D"
tehftw,AskReddit,1388534467.0,"Ad 1 &amp; 2. Right. I was mistaken.

Ad 3. I'm not against firearms. I'd rather everyone had access to weapons."
timsstuff,movies,1388534468.0,"I thought it was Colm Meaney whenever he's in a serious role.

[Colm Meaney](https://www.google.com/search?q=colm+meaney&amp;tbm=isch)    
[John C. Reilly](https://www.google.com/search?q=john+c+reilly&amp;tbm=isch)"
Bullseye4hire,hockey,1388534470.0,FAck. Looks like 4 mins.
Justvotingupordown,Music,1388534474.0,"I hate to respond to such an unnecessarily vulgar attack, but here we go.

Pitchfork has created and sustained an echo chamber which holds that popular music (an inherently subjective product) is either ""the best thing ever"" or ""literally Hitler.""

This has led to the hilarious result above, where the Pitchfork audience doesn't quite know what to do with the biggest album of the year (""It's different! But it's in your face! But Kanye is popular! But he's married to a dumb pretty girl!"") so it ends up #1 in all three categories.

Sorry if you've got something riding on Pitchfork's credibility, but I think this has been pretty well established."
Bullseye4hire,rangers,1388534487.0,Double minor for sure with all that blood. FACK!
JAWJAWBINX,AskMen,1388534489.0,"Dazzle and Silencer aren't that hard to use, I'm not great at them (problems with mostly playing styles where I off one person then the next till they're all gone and my computer acting up screwing up my reactions) but if you do ok with OM and SS then they shouldn't pose any issue. I've just been doing pure bot matches, I don't get any BP but I get to practice and there are people here so being able to quit at any time is good."
Bananaguacamole,hiphopheads,1388534496.0,Where does he put his balls???
ARGYLE_NIGGLET,AskReddit,1388534514.0,"My very picky friend who refuses to eat vegetables recently discovered she can make her greasy fast food tacos ""healthier"" by putting some iceberg lettuce on them."
dewprisms,mildlyinteresting,1388534538.0,"Right, but (typically) the temps do not get as low as they do with windchill. On top of that, the blowing air tends to cut through a lot of clothing and sting your skin."
irrational_abbztract,jailbreak,1388534551.0,"If it were to delete important, sure it would cause problems but it doesn't do that unless you make it do so. Leave the default settings as they are and nothing will go wrong. Its a great tweak. "
aggressive_silence,ShitRedditSays,1388534554.0,"He will explode into 10 to 15 cats, depending upon his weight and height."
Justvotingupordown,Music,1388534560.0,"Don't quote me as saying other music publications aren't circlejerks. Music criticism in general is, although it's probably better characterized as naval-gazing up until the point where it can actually change the industry, like PF and NME."
shafonfa,AskWomen,1388534564.0,It would honestly gross me out. But that's how I feel about sex toys in general.
MidnightSlinks,washingtondc,1388534573.0,[There's someone who posted on here today asking for tickets](http://www.reddit.com/r/washingtondc/comments/1u4dbi/anyone_have_a_ticket_to_black_cats_nye_ball/)
karmapilot,WTF,1388534575.0,"Holy shit, thanks for the laugh. And Happy New Year!"
aggressive_silence,ShitRedditSays,1388534576.0,Only if you pet them on a regular basis.
Gl33m,childfree,1388534589.0,"Dear OP, I'm sorry for your experience. But look on the bright side, I got to see some very pretty kitties posted because of it. &lt;3 OP and OP's cat."
Mello2912,Wicca,1388534590.0,"Witch/yogi/psychonaut here. I don't combine psychedelics with rituals or magic, I feel a sober mind is the best way to honor the Lord and Lady. I do sometimes use cannabis and mushrooms when meditating to experiment with the differences. I like to take note of the experiences and meditate on them with a sober mind later.

You'll find most witches are eclectic and have a very broad range of beliefs, as proven by the variety of statements found here. As a bottom line, most of us would agree that you should do whatever feels right for you. Life will take you where it may."
devilinmexico13,todayilearned,1388534603.0,Several well known and influential [documentaries](http://www.youtube.com/watch?v=LxQa8VL8bUg&amp;list=PL126E4597877E1756) have shown that M.A.R.S. Industries is a supplier of one of the worst terrorist organizations in the world. 
irrational_abbztract,explainlikeimfive,1388534622.0,"This covers is well. If I recall correctly, only 0.02% of all donations actually reach the people they were intended for."
karmapilot,WTF,1388534631.0,I think you might just be on the rag.
The_Lion_Jumped,AskReddit,1388534644.0,Accurate. 
keypuncher,Republican,1388534650.0,"&gt; A - The government doesn't fund all minimum wage jobs, I'm not quite sure where you heard that.

We're not talking about minimum wage jobs.  We're talking about Basic Income - i.e., a minimum income paid to everyone by the government.  I used the full-time minimum wage as a starting point.

&gt; B - Only about a third of the populace can work, I'm not sure why that is so low but apparently when you take out the old, the young and the sick that's what your stuck with. Not 250mil. More like 100mil.

This number is not correct.  The working age population (16+) is 250 million.  [Somewhat over half \(58.6%\) have a job.](http://data.bls.gov/timeseries/LNS12300000)  That is 146.5 million.  Regardless, we're talking about a basic income, paid to everyone."
goldy_locks,BabyBumps,1388534658.0,Zero! Woo Hoo! 
irrational_abbztract,AskHistorians,1388534661.0,Does this remind anyone else of Rome Sweet Rome?
Zalbu,photography,1388534669.0,"He shoots Nikon, though. He even puts Nikon straps on Canon bodies."
AKCheesehead,GreenBayPackers,1388534713.0,I think the play clock we see on TV is like the yellow first down line. Not offical.
irrational_abbztract,battlefield_4,1388534716.0,What timezone?
sweetpea122,Frugal,1388534790.0,"Even if she bought $70 worth of books or CDs at goodwill (which is easy for an avid reader to do), she still saved money. That's the point. "
irrational_abbztract,buildapcsales,1388534791.0,God dammit. USA only. Australia will get lucky one of these days...hopefully.
ProtoKun7,gallifrey,1388534821.0,"It was time locked, but the Moment let them in. It was commented on."
keypuncher,conservatives,1388534830.0,"&gt; How does the grid work now with constantly changing demand if all power plants take hours to spin up?

The demand is relatively predictable, and the output of coal, oil, gas and nuclear-fired plants is very predictable.

Plants are built in the areas they are needed, limited amounts of electricity can be sent to other areas via transmission lines."
JewSmurf,AdviceAnimals,1388534837.0,Because they can speak English.
ChrisVolkoff,PenmanshipPorn,1388534865.0,"&gt; inamoratos

TIL a new word."
xerofailgames,movies,1388534865.0,hell no i liked HIM as the actor i meant the production could have taken better steps...him as matt murdoch i think was a good choice
irrational_abbztract,LifeProTips,1388534877.0,"Go to your posts and under it there should be a ""flair"" button. Click that and choose the appropriate option. ""Flairing"" a post gives it whatever tag you have chosen"
ProtoKun7,gallifrey,1388534895.0,"The Moment was also described as a galaxy eater. I actually theorised that if the name was appropriate, it might take everything in a set radius and compress it into one ""moment"" in spacetime, causing a massive annihilation effect."
Sahil17,Christianity,1388534919.0,Well that's terrifying to think that it happens so often that they aren't scared of it anymore. 
goat_I_am,nfl,1388534931.0,Because everyone from cali is soft. 
morbiusgreen,ExploreFiction,1388534947.0,*He transformed into his humanlike form and hugged her.*
morbiusgreen,ExploreFiction,1388534963.0,"""Won't your husband be jealous?"""
morbiusgreen,ExploreFiction,1388534991.0,*Kansra made a manhood for herself and hovered over Dom.*
colonel2113,democrats,1388534993.0,"I'm not saying it is bad to not try, but the idea is humanly impossible.  Human nature will always make it impossible.  

People would have to be genetically modified to become emotionless robots to achieve such a goal.  

Poverty has always been and always be around.
"
Bullseye4hire,hockey,1388534998.0,"I think at this point that probably your best move, get pucks in deep, mostly to kill off time and hopefully win a board battle to get something out in front. "
morbiusgreen,ExploreFiction,1388535008.0,*Jon kept pouring.*
kiaha,MLPLounge,1388535011.0,How formal we talking here? Grand Galloping Gala or a bunch of work friends kind of formal? 
PEANUT_BUTTER_AND_JE,circlebroke,1388535015.0,You worded that as if it were a bad thing.
Satafly,pics,1388535016.0,"oh wow, do you make your own?"
morbiusgreen,ExploreFiction,1388535023.0,"""Shall we head to the marketplace then?"""
morbiusgreen,ExploreFiction,1388535038.0,*The taste was different but still tasty.*
wishforagiraffe,Random_Acts_Of_Amazon,1388535040.0,"happy new year! i'm going to a hockey game with my parents tonight (i'm 25 and this doesn't bother me at all) and plan to be in bed as soon as i get home from the game. my last two new years i spent somewhat upset with my (ex)bf, so this year will be better, even if there's no kiss for me either."
ProtoKun7,gallifrey,1388535041.0,"No she didn't. She only forgot the events of that episode, including reading the Doctor's name. Her memories were restored by the TARDIS' telepathic circuits in *The Name of the Doctor*."
Firewasp987,teenagers,1388535051.0,how do you vigorously tip a fedora? 
karmapilot,firstworldanarchists,1388535053.0,"Trust me, you don't wanna go down this path. [I've tried to talk about this before.](http://www.reddit.com/r/firstworldanarchists/comments/1sghlz/nathan_gets_it/cdxfvqa?context=2)

He still has my downvote though."
bunk88,aww,1388535053.0,Need Banana for scale. For all I know each one of those puppies is larger than a fully grown chocolate lab.
eetsumkaus,CFB,1388535057.0,we'd like to take credit for guaranteeing an extra win to everyone in the PAC-12 this year and playing a part in getting 9 teams to bowl games despite playing a 9 game conference schedule. Thank you thank you.
morbiusgreen,ExploreFiction,1388535061.0,"*Jon turned away, crying.*

""I need to clean! Please let me go!"""
ToastyXD,LifeProTips,1388535062.0,"With your last edit, false. Gas exchange is constant. No matter if you don't take a breath in or not, you will always breathe out carbon dioxide. It's best to stay calm and control your breath instead of freaking out."
itscherried,electronic_cigarette,1388535071.0,"6 mg 50/50
Thanks!"
AnDyzZzoRe,asoiaf,1388535078.0,"I'm on my pc now and just jumped on the wiki.
here is a relevant section

&gt;During his first tourney, he was competing against Prince Oberyn Martell of Dorne, who knocked Willas from his horse. Unfortunately, his foot caught in his stirrup as he fell, and he pulled his horse on top of him, crushing his leg and leaving him a cripple.
Though the incident fanned the flames of the considerable enmity between Houses Tyrell and Martell, Willas bore Oberyn no personal ill will and the two long remained in correspondence, sharing a passion for horseflesh.

So yeh it seems a bit petty for the others of House Tyrell if Willas himself dealt with it quite well,"
morbiusgreen,ExploreFiction,1388535081.0,*He woke in a sweat in the middle of the night.*
laa916,Patriots,1388535089.0,Oooooh that's hot
morbiusgreen,ExploreFiction,1388535093.0,"""You've played Halo right?"""
Fairy_floss84,funny,1388535103.0,I am a straight girl and daayyyuum! What is her name ? 
luckytwentytwo,AskWomen,1388535105.0,"Well, I'm not PMSing today so nothing has really irritated me (so far) :)

But! The week before I start my period, I cry over the most ridiculous things. Most of the time, its the simple fact that I'm a waitress/college student in a small town that sets me off. Even an inkling of that not-making-progress-in-life feeling, and bring on the water works (granted, yes I'm in school so I am making progress... but it doesn't always feel like that). 

One time, my boyfriend and I went out for pizza. We split a pitcher of beer so I was a teeeeensy bit tipsy, and terrrribly hormonal but trying not to think about it. It was obvious that I was done drinking, but I was *pretending* to pour the last sip of beer into my glass, while my boyfriend gave me that ""don't you dare"" look. Welp, I tipped the pitcher just a tiny bit too far and actually poured the beer. Immediately I went into that ""Crap! Sorry! I didn't seriously mean to do that!"" mode and tried to slide the glass over to him... accidentally tipping the glass and pouring the beverage all over the table. I immediately burst into tears and we had to leave the restaurant. 

It totally would NOT have been a big deal if I wasn't about to start my period. :("
ProtoKun7,gallifrey,1388535107.0,"What she did still happened in her history, even if the entry point has gone. It still takes effect."
PunxsatownyPhil,lewronggeneration,1388535110.0,"You're missing my point. What if I said I was a proud non-math-user? Or that I was proud of not listening to rap? Taking PRIDE in not doing something, especially something mentally stimulating, is ridiculous.

And who said it needs to be novels? Why not world history books?



And have [this link.](http://online.liebertpub.com/doi/abs/10.1089/brain.2013.0166)"
Dude_Im_Godly,MaddenCC,1388535112.0,1st rounder. 
morbiusgreen,ExploreFiction,1388535117.0,*Halfax got on her knees and used her tail to tease her clit.*
jpla86,AskMen,1388535119.0,No.
morbiusgreen,ExploreFiction,1388535139.0,*Jon looked inside her to see if she was happy and why.*
Jess_than_three,leagueoflegends,1388535146.0,"You guys could use a Ghostcrawler. In fact, have you considered hiring Ghostcrawler? "
tehftw,AskReddit,1388535147.0,Tax service and your dog will never leave nor forget you.
Armitando,TheSimpsons,1388535148.0,Wheeeeeeeee
morbiusgreen,ExploreFiction,1388535161.0,"""Nothing my bitch."""
irrational_abbztract,jailbreak,1388535169.0,"I like this idea. 

I'd also love iOS 6's Auxo on iOS 7. That would be fantastic."
Bullseye4hire,rangers,1388535171.0,Anton is probably at an 8 after getting stoned by Thomas there. 
sexandliquor,Cartalk,1388535177.0,Seek professional help.
Bullseye4hire,hockey,1388535178.0,"Anton is probably at an 8 after getting stoned by Thomas there.
"
ProtoKun7,doctorwho,1388535184.0,Cycle can refer both to the full set of twelve and the process of one on its own.
morbiusgreen,ExploreFiction,1388535188.0,"""I-I'll lick your feet! I'll do everything you say! Please don't hurt me!"""
aDDnTN,motorcycles,1388535200.0,"Rational? That isn't what I would call a superstitious zealot afraid of his own shadow, black cats, or breaking mirrors.

Believe me, a little bell isn't gonna do shit to keep your shiny side up."
morbiusgreen,ExploreFiction,1388535209.0,*They went to play in the small children's pool.*
MaybeILoveYou,offmychest,1388535217.0,"I'm in a shitty mood right now so I'm not going to tiptoe around and couch words and I don't give a shit about downvotes.  Your mother doesn't owe you shit.  It's her choice if she wants to have a secret affair.  What entitles you to that private information?  Having mental health issues?  Fuck that.  Grow up.  You actually expected her to take care of you after her husband died?  What have you done for her to take care of her needs?  Of course she needs to ""BE SELFISH"" after taking care of your selfish ass for 18 years."
Bullseye4hire,hockey,1388535234.0,"Which is exactly why you're legs should keep moving, if you keep up the dump and chase."
morbiusgreen,ExploreFiction,1388535234.0,"""Well, we can get to know each other better. Tell me a little more about yourself, Mr. Blackstone."""
MightyGamera,pics,1388535236.0,"Same with a buddy of mine while camping. He had his bull mastiff tied to a tree, and a german shepherd from the neighboring lot wandered over and attacked. 

The owners kicked and beat the mastiff to get him to release the shepherd who was picked off the ground and being shaken by the neck, and this didn't even phase him. 

Resulted in about 3500 in vet bills for the shepherd and an unsuccessful lawsuit, and an unsuccessful attempt to get Hunter put down. "
wishforagiraffe,Random_Acts_Of_Amazon,1388535239.0,"i have absolutely no ""baspingo"" (seems like it could be a curse, right?) idea how to do these fancy links where people just make their text blue and go to what they want while it says something completely different, so here's my item- http://www.amazon.com/dp/B002RL9CR2/ref=wl_it_dp_o_pC_nS_img?_encoding=UTF8&amp;colid=2QE4VELJS5Y85&amp;coliid=I2HA5GWD6EO7RO

it would be awfully nice to get my kitchen utensils all rounded up into one convenient area, and this would do that."
dreamingofjellyfish,TwoXChromosomes,1388535240.0,"If you are a hypochondriac maybe don't read on until you've tried cleaning your fridge. 

Spontaneous cerebralspinal fluid leakage may cause a metallic taste, but not solely when eating. Other symptoms include dizziness, nausea, fatigue, involuntary muscle twitches, ringing ears, tingling in the limbs, and facial weakness (source: [Wikipedia of course](http://en.wikipedia.org/wiki/Spontaneous_cerebrospinal_fluid_leak)). You almost certainly do not have this, but I think it's an interesting phenomenon and always think of it when someone mentions an unexplained metallic taste.
"
Satafly,mildlyinteresting,1388535244.0,"Fuck it, I thought it was appropriate."
edisraw1,tall,1388535245.0,"I know what you mean but I don't share it. I'm sure I am intimadating to some people but I have one of those ""as soon as he walks in the room people notice and start talking to him."" situations going on. And it's not about being attractive (I am overweight and meh looking imo.) it's just an ire I've carried since becoming of legal drinking age. I would say just walk in places with your head held high waving your arms where you please and to hell with those in your way, but I know introversion is a hard thing to kick by experience. And that goes double for someone that has a self conscious feeling to go with that introversion. All I can really say is try to loosen up and if you can't realize there is nothing fundamentally wrong with you and technically the world is getting taller with every generation. So in a few decades from now you'll be the norm might as well start acting like it now."
AgentMullWork,Bitcoin,1388535247.0,That requires no new money put into bitcoin.
FrankReynolds,Guildwars2,1388535253.0,Angst-ridden children ruin literally everything.
morbiusgreen,ExploreFiction,1388535260.0,"""We intend to do that. Now, shall we head back to our new home?"""
doc_birdman,cringepics,1388535278.0, They redefined something to fit their agenda. Just because you change the name and say something is the doesn't make it true.
cfedey,MonsterHunter,1388535286.0,"Right. Probably should have mentioned that they were different. In terms of difficulty, it generally goes like this: 

Moga LR &lt; Port LR &lt; Moga HR &lt; Port HR &lt; Port G"
doc_birdman,funny,1388535295.0,"Mhmm, I bet. "
theo13,WTF,1388535311.0," 
    ""TWO roads diverged in a yellow wood,	
    And sorry I could not travel both	
    And be one traveler, long I stood	
    And looked down one as far as I could	
    To where it bent in the undergrowth;	        
     
    Then took the other, as just as fair,	
    And having perhaps the better claim,	
    Because it was grassy and wanted wear;	
    Though as for that the passing there	
    Had worn them really about the same,	        
 
    And both that morning equally lay	
    In leaves no step had trodden black.	
    Oh, I kept the first for another day!	
    Yet knowing how way leads on to way,	
    I doubted if I should ever come back.	        
 
    I shall be telling this with a sigh	
    Somewhere ages and ages hence:	
    Two roads diverged in a wood, and I—	
    I took the one less traveled by,	
    And that has made all the difference."""
R99,AskReddit,1388535325.0,Bet on every Super Bowl winner and winners of all games I can remember. 
Jevia,MakeupAddicts,1388535331.0,Ulta had a one day sale on it right after christmas. :D
shiv4m,tall,1388535356.0,6'10 is tall af
Fairy_floss84,funny,1388535363.0,My cat was given to me by a previous boyfriend. Do I get a new card ?
MeUpvotesta,skrillex,1388535370.0,"But if there is a release, I will break a sweat."
Jlc2100,WTF,1388535372.0,*Plunders ye anus!*
FrankReynolds,hockey,1388535382.0,"Yeah, if we somehow fall into an abundance of good defense, I could see him transitioning to forward.  Problem with that happening is that he's also a fantastic defenseman.  We'd have to be hip-deep in Brodin and Suter clones before the Wild would even think about it."
ProtoKun7,doctorwho,1388535387.0,"It really can't, unless you mean [this](http://4.bp.blogspot.com/_D_Z-D2tzi14/S8TRIo4br3I/AAAAAAAACv4/Zh7_GcMlRKo/s1600/ALOT.png). The closest thing is ""allot"" and that means something else."
sandmans,femalefashionadvice,1388535440.0,"I personally love Citizen eco drives. they are very simple and durable, and you'll never have to change the battery =)"
losapher,mildlyinteresting,1388535450.0,"On this past Saturday and Sunday the ""feels like"" temperatures were 40 degrees and -40 degrees "
ProtoKun7,gallifrey,1388535452.0,"That's due to his species having longevity compared to humans. Time Lords live for a long time, even though most of them don't even use a TARDIS."
jpla86,AskMen,1388535453.0,I don't remember the last time I had anything close to a good year. Im hoping 2014 will be a better year for me but im still skeptical though.
ReverendDexter,sex,1388535458.0,"They almost certainly weren't consciously faking it, for those few years, they probably were ""changed"" and putting honest effort in to be more what their partner wanted. But, you can only fight your true nature so much and for so long, so eventually they return to their actual selves.  It's why it's so important to be honest in a relationship and to yourself.  It's much better to find out you're not compatible and be free to find someone with whom you are than it is to think you can ""suck it up"" or ""compromise"" or ""settle"" and have a life where neither of you are happy and you grow to resent your partner over what should have been."
chisholmmmmm,FIFA,1388535471.0,"Dammit. Sneijder was my highest rated, only valuable players were Piszscek (forgive me I tried to spell it) and Schürrle"
ProtoKun7,gallifrey,1388535477.0,"Yes, when I heard that speech I actually thought back to this concept too."
KidVicious13,AskReddit,1388535501.0,I'm gonna need the name of that porn star.
Indifference11,AskReddit,1388535503.0,Please don't remind me of my past nightmares. *shudders
